ID,Adjudication,Classification,Text
356,Adjudicated,Neutral,"As you know, this is my first public address since I took over my new job. When the New Frontiersmen rode into town, I locked myself in my office to do my homework and get my feet wet. But apparently I haven't managed yet to stay out of hot water. I seem to have detected a very nervous apprehension about what I might say or do when I emerged from that locked office for this, my maiden station break. So first let me begin by dispelling a rumor. I was not picked for this job because I regard myself as the fastest draw on the New Frontier. Second, let me start a rumor. Like you, I have carefully read President Kennedy's messages about the regulatory agencies, conflict of interest, and the dangers of ex parte contacts. And, of course, we at the Federal Communications Commission will do our part. Indeed, I may even suggest that we change the name of the FCC to The Seven Untouchables."
357,Adjudicated,Neutral,"From the beginning of our administration, we've taken strong steps to do something about this horror. Tonight I can report to you that we've made much progress. Thirty-seven federal agencies are working together in a vigorous national effort, and by next year our spending for drug law enforcement will have more than tripled from its 1981 levels. We have increased seizures of illegal drugs. Shortages of marijuana are now being reported. Last year alone over 10,000 drug criminals were convicted and nearly $250 million of their assets were seized by the DEA, the Drug Enforcement Administration. And in the most important area, individual use, we see progress. In 4 years the number of high school seniors using marijuana on a daily basis has dropped from 1 in 14 to 1 in 20. The U.S. military has cut the use of illegal drugs among its personnel by 67 percent since 1980. These are a measure of our commitment and emerging signs that we can defeat this enemy. But we still have much to do."
358,Adjudicated,Neutral,"In this situation, it becomes vital that our own country orient its policies in consonance with this basic evolutionary condition rather than pursue a course blind to the reality that the colonial era is now past and the Asian peoples covet the right to shape their own free destiny. What they seek now is friendly guidance, understanding, and support -- not imperious direction -- the dignity of equality and not the shame of subjugation. Their pre-war standard of life, pitifully low, is infinitely lower now in the devastation left in war's wake. World ideologies play little part in Asian thinking and are little understood. What the peoples strive for is the opportunity for a little more food in their stomachs, a little better clothing on their backs, a little firmer roof over their heads, and the realization of the normal nationalist urge for political freedom. These political-social conditions have but an indirect bearing upon our own national security, but do form a backdrop to contemporary planning which must be thoughtfully considered if we are to avoid the pitfalls of unrealism."
359,Adjudicated,Neutral,"My administration must decide whether to allow federal funds, your tax dollars, to be used for scientific research on stem cells derived from human embryos.  A large number of these embryos already exist.  They are the product of a process called in vitro fertilization, which helps so many couples conceive children.  When doctors match sperm and egg to create life outside the womb, they usually produce more embryos than are planted in the mother.  Once a couple successfully has children, or if they are unsuccessful, the additional embryos remain frozen in laboratories. Some will not survive during long storage; others are destroyed.  A number have been donated to science and used to create privately funded stem cell lines.  And a few have been implanted in an adoptive mother and born, and are today healthy children."
360,Adjudicated,Pessimistic,"I remember in college under George Bush picking up those science books, leaning into compelling fields because I was concerned about having to preserve fact over demagoguery. And here we are again, where President Obama had 125 people serving in the White House Office of Science and Technology Policy because he believed fact-driven data-driven policy – policy that I was privileged enough to work on. Our current president has barely put a person in that office, because it is evident he and his cabinet do not care about fact or a science-driven agenda. We could be leading a new space race to Mars but yet here I stand with you demanding to let our scientists be allowed to do their work without censorship from our own federal government."
361,Adjudicated,Pessimistic,"He was given an ultimatum -- and he made his choice for war. And the result of that war was to rid a -- the world of a murderous dictator who menaced his people, invaded his neighbors, and declared America to be his enemy. Saddam Hussein, captured and jailed, is still the same raging tyrant -- only now without a throne. His power to harm a single man, woman, or child is gone forever. And the world is better for it. Since the removal of Saddam, this war, like other wars in our history, has been difficult. The mission of American troops in urban raids and desert patrols, fighting Saddam loyalists and foreign terrorists, has brought danger and suffering and loss. This loss has caused sorrow for our whole nation -- and it has led some to ask if we are creating more problems than we're solving."
362,Adjudicated,Optimistic,"The Prime Minister was the first of the leaders from other lands who was invited to call upon me shortly after I entered the White House; and this is my first trip--the first trip of my wife and myself outside of our country's borders. It is just and fitting, and appropriate and traditional, that I should come here to Canada--across a border that knows neither guns nor guerrillas. But we share more than a common border. We share a common heritage, traced back to those early settlers who traveled from the beachheads of the Maritime Provinces and New England to the far reaches of the Pacific Coast. Henry Thoreau spoke a common sentiment for them all: ""Eastward I go only by force, Westward I go free. I must walk towards Oregon and not towards Europe."" We share common values from the past, a common defense line at present, and common aspirations for the future-our future, and indeed the future of all mankind."
363,Adjudicated,Neutral,"Like Donald Trump, I saw what was happening to our great country and I felt like I had no choice. Our nominee speaks to the American people in their capacity as citizens. They can be any race or religion, but they must in accepting the freedom and the protection that our nation provides, take on the obligations and the duties of citizenship. The whole notion sounds vaguely outdated too many ears, particularly those in the media and the political elites. We hear a lot these days about what everyone is entitled to especially what political correctness dictates we must say or do, but our nominee speaks to us as individuals, as citizens of the greatest country the world has ever known. And he wants to conserve the freedom and greatness of that country, and that I submit to you ladies and gentlemen, is the most conservative and the best work that can be done by anyone in this day in this country."
364,Adjudicated,Optimistic,"Most importantly, my administration is working with Congress to address the root cause behind much of the instability in our markets. Financial assets related to home mortgages have lost value during the housing decline. And the banks holding these assets have restricted credit. As a result, our entire economy is in danger. So I've proposed that the federal government reduce the risk posed by these troubled assets, and supply urgently-needed money so banks and other financial institutions can avoid collapse and resume lending. This rescue effort is not aimed at preserving any individual company or industry -- it is aimed at preserving America's overall economy. It will help American consumers and businesses get credit to meet their daily needs and create jobs. And it will help send a signal to markets around the world that America's financial system is back on track."
365,Adjudicated,Pessimistic,"Our nation is facing an unprecedented global crisis that highlights the inextricable bonds of humanity and how foreign policy and domestic policy are inseparable. We are all in this together and we must all rise to meet this moment in service to our country and our fellow man. This is not the first time that we have faced adversity together and it will not be the last. After the terrorist attack by al Qaeda on our country on 9/11 we stood together as Americans. Motivated to serve, marshaling our forces to defeat our common enemy. I and so many Americans all across this country enlisted in the military to do just that. Likewise, today as Americans — and all of humanity — we face a common enemy. It is once again time as Americans and as neighbors in this global community that we stand together once again and work hand-in-hand to defeat this new enemy — the coronavirus. Throughout my life and throughout this campaign, my motivation has been to serve God, our country, and the American people as best I can. I feel that the best way that I can be of service at this time is to continue to work for the health and well-being of the people of Hawaii and our country in Congress and to stand ready to serve in uniform should the Hawaii National Guard be activated."
366,Adjudicated,Neutral,"Just moments ago, I spoke with George W. Bush and congratulated him on becoming the 43rd president of the United States. And I promised him that I wouldn't call him back this time. I offered to meet with him as soon as possible so that we can start to heal the divisions of the campaign and the contest through which we've just passed. Almost a century and a half ago, Senator Stephen Douglas told Abraham Lincoln, who had just defeated him for the presidency, ""Partisan feeling must yield to patriotism. I'm with you, Mr. President, and God bless you."" Well, in that same spirit, I say to President-elect Bush that what remains of partisan rancor must now be put aside, and may God bless his stewardship of this country. Neither he nor I anticipated this long and difficult road. Certainly neither of us wanted it to happen. Yet it came, and now it has ended, resolved, as it must be resolved, through the honored institutions of our democracy."
367,Adjudicated,Pessimistic,"We’re here because of some hardworking women. Women, who more than a 100 years ago worked long hours in a brown, 10 story building, just a block that way. Women who worked at the Triangle Shirtwaist Factory. So here’s what I want you to hear. It was March 25th, 1911, it was a Saturday. And at about 4:45 in the afternoon, people walking through this very park looked up and saw black smoke billowing into the sky. A fire had started in that building and inside that building on the top three floors, deadly flames leaped from a bin to the oily floors and from the floors to the walls sweeping across workrooms and trapping the workers fighting for their lives. Women, girls really, some as young as 14 raced to escape, but the exit doors were locked. Others ran to the windows, waving their arms and screaming for help. No help was coming. The fire department’s ladders could only reach to the sixth floor. The flames leaped higher and women started crawling out onto the ledges. And as people on the ground stood in shocked silence, a woman jumped and then another and then another. They hit the ground with a sickening thud. They died on impact so many so fast that the women’s bodies piled up on the sidewalk. Their blood ran into the gutters. Dozens more were tracked inside, trapped because the door to the staircase was locked, locked by bosses afraid that the workers might steal scraps of cloth. Firefighters would later find a pile of burned bodies next to that locked door. It took 18 minutes for 146 people to die. Mostly women, mostly immigrants, Jewish and Italian, mostly people who made as little as five dollars a week to get their shot at the American dream. It was one of the worst industrial disasters in American history, one of the worst, but it should not have been a surprise."
368,Adjudicated,Pessimistic,"And yet our distress comes from no failure of substance. We are stricken by no plague of locusts. Compared with the perils which our forefathers conquered, because they believed and were not afraid, we have still much to be thankful for. Nature still offers her bounty and human efforts have multiplied it. Plenty is at our doorstep, but a generous use of it languishes in the very sight of the supply. Primarily, this is because the rulers of the exchange of mankind's goods have failed, through their own stubbornness and their own incompetence, have admitted their failure, and have abdicated. Practices of the unscrupulous money changers stand indicted in the court of public opinion, rejected by the hearts and minds of men."
369,Adjudicated,Optimistic,"Thank you very much. Governor Keating and Mrs. Keating, Reverend Graham, to the families of those who have been lost and wounded, to the people of Oklahoma City who have endured so much, and the people of this wonderful State, to all of you who are here as our fellow Americans. I am honored to be here today to represent the American people. But I have to tell you that Hillary and I also come as parents, as husband and wife, as people who were your neighbors for some of the best years of our lives."
370,Adjudicated,Optimistic,"This is an extraordinary experience. And I’m very aware, particularly as a woman, that we can’t do this everywhere. I’m very aware particularly as a woman that if I said a fraction of the things that I sometimes say in critique of our government and our governmental policy, that there are countries were I might be taken off to prison, even tortured. So I’m not only very aware of the profound right that we have to say what we think, but at this point in our history I think we need to remember that we also have a profound responsibility to say what we think. I’m running for president because I think some things need to be said. And the things that I believe need to be said, or what everybody I know is saying. I believe that our politics itself is not a conduit for the energies that we need to be expressing in order to move to the next phase of our history. Politics is stuck somewhere in the 20th century. Our hearts are in the 21st century but our politics need to become more aligned with where we are as people. I don’t see a problem with the American people. I think we’re a good and decent people, I don’t think we’re any better than anybody in any other country."
371,Adjudicated,Optimistic,"I hear it from so many of you: the frustration of parents juggling work while they support their children’s learning—or are afraid that their kids might get sick from school. The concern of every person working without enough protection. The despair in the lines that stretch out before food banks. And the indescribable sorrow that follows every lonely last breath when the ventilators turn off. As a mother and a grandmother, as an American, I am heartbroken by the magnitude of this loss—by the failure to protect our communities—by every precious and irreplaceable life gone. Like so many of you, I’m left asking: how do I keep my family safe?"
372,Adjudicated,Pessimistic,"Here lie people—Jews—whose death was inflicted for no reason other than their very existence. Their pain was borne only because of who they were and because of the God in their prayers. Alongside them lay many Christians—Catholics and Protestants. For year after year, until that man and his evil were destroyed, hell yawned forth its awful contents. People were brought here for no other purpose but to suffer and die—to go unfed when hungry, uncared for when sick, tortured when the whim struck, and left to have misery consume them when all there was around them was misery."
373,Adjudicated,Optimistic,"In Bunyan's ""Pilgrim's Progress"" you may recall the description of the Man with the Muck Rake, the man who could look no way but downward, with the muck rake in his hand; who was offered a celestial crown for his muck rake, but who would neither look up nor regard the crown he was offered, but continued to rake to himself the filth of the floor. In ""Pilgrim's Progress"" the Man with the Muck Rake is set forth as the example of him whose vision is fixed on carnal instead of spiritual things. Yet he also typifies the man who in this life consistently refuses to see aught that is lofty, and fixes his eyes with solemn intentness only on that which is vile and debasing."
374,Adjudicated,Pessimistic,"During the 90 days that began on April 6, in 1994, Rwanda experienced the most extensive slaughter in this blood-filled century we are about to leave—families murdered in their homes, people hunted down as they fled by soldiers and militia, through farmland and woods as if they were animals. From Kibuye in the west to Kibungo in the east, people gathered seeking refuge in churches by the thousands, in hospitals, in schools. And when they were found, the old and the sick, the women and children alike, they were killed—killed because their identity card said they were Tutsi or because they had a Tutsi parent or because someone thought they looked like a Tutsi or slain, like thousands of Hutus, because they protected Tutsis or would not countenance a policy that sought to wipe out people who just the day before, and for years before, had been their friends and neighbors."
375,Adjudicated,Optimistic,"I'm Wendy Long. I'm a New Yorker, a wife, mother and attorney. America has given me so much. I was blessed with great, hard-working parents and I had a rare opportunity to learn from some of the best about what makes our country great. I clerked for one of them at the U.S. Supreme Court. I believe in real New York values, individual freedom, hard work, personal responsibility, strong families, generosity to our fellow citizens and love for our neighbors. I'm running for the United States Senate to bring those values back."
376,Adjudicated,Optimistic,"To strengthen the unity of the West, our journey opened in Paris and closed in London. My talks with General de Gaulle were profoundly encouraging to me. Certain differences in our attitudes on one or another problem became insignificant in view of our common commitment to defend freedom. Our alliance, I believe, became more secure; the friendship of our nation, I hope--with theirs--became firmer; and the relations between the two of us who bear responsibility became closer, and I hope were marked by confidence. I found General de Gaulle far more interested in our frankly stating our position, whether or not it was his own, than in appearing to agree with him when we do not. But he knows full well the true meaning of an alliance. He is after all the only major leader of World War II who still occupies a position of great responsibility. His life has been one of unusual dedication; he is a man of extraordinary personal character, symbolizing the new strength and the historic grandeur of France. Throughout our discussions he took the long view of France and the world at large. I found him a wise counselor for the future, and an informative guide to the history that he has helped to make. Thus we had a valuable meeting."
377,Adjudicated,Pessimistic,"Our prayers tonight are with the victims and their families in their time of terrible grief. Our hearts go out to them—to brave people like Kathryn McDonald, the wife of a Congressman whose composure and eloquence on the day of her husband's death moved us all. He will be sorely missed by all of us here in government. The parents of one slain couple wired me: ""Our daughter ... and her husband ... died on Korean Airline Flight 007. Their deaths were the result of the Soviet Union violating every concept of human rights."" The emotions of these parents—grief, shock, anger—are shared by civilized people everywhere. From around the world press accounts reflect an explosion of condemnation by people everywhere."
378,Adjudicated,Optimistic,"Thank you. Thank you. Your eminence, your excellencies, members of the clergy, Donald and Melania, and all the distinguished guests. Earlier tonight, Al reminded me that when the first Al Smith ran for president, he chose the progressive senator from Arkansas, Joseph G. Robinson, who is one of my husband's political heroes. This work that you do through the dinner, Al— you have done it now for 30 years— is such a labor of love. You have been a hero for both the children of the archdiocese and for the city of New York, and I think we all owe Al Smith a great round of applause."
379,Adjudicated,Optimistic,"We entered this war because violations of right had occurred which touched us to the quick and made the life of our own people impossible unless they were corrected and the world secure once for all against their recurrence. What we demand in this war, therefore, is nothing peculiar to ourselves. It is that the world be made fit and safe to live in; and particularly that it be made safe for every peace-loving nation which, like our own, wishes to live its own life, determine its own institutions, be assured of justice and fair dealing by the other peoples of the world as against force and selfish aggression. All the peoples of the world are in effect partners in this interest, and for our own part we see very clearly that unless justice be done to others it will not be done to us. The program of the world's peace, therefore, is our program; and that program, the only possible program, as we see it, is this:"
380,Adjudicated,Optimistic,"I'd like to just acknowledge in general the people who are here from law enforcement organizations and firefighters' organizations and public employees and teachers' groups who have helped us on this national service project. And I want to say a special word of thanks to three other people. First of all, Gen. David Jones, a former Chairman of the Joint Chiefs of Staff who has worked very hard helping us put together this program, who is here. General Jones, thank you for being here. Secondly, a remarkable gentleman from New Jersey, an immensely successful businessman who retired early and is devoting his entire life to community service to rebuild the lives and the neighborhoods of the people in his community in New Jersey and now helping others around the country, a founding Member of the Points of Light Foundation, Mr. Ray Chambers, who is here. And I'd like to pay a little special attention to two members of Congress who are not here and to one who is, for their long work on the whole idea of national service. The two in the Senate who are not here are Senator Harris Wofford from Pennsylvania and Senator Sam Nunn from Georgia. And then Representative Dave McCurdy from Oklahoma, thank you for all of the work you've done on this over the years."
381,Adjudicated,Pessimistic,"During the past three years I’ve spoken to you on many occasions about national concerns, the energy crisis, reorganizing the government, our nation’s economy, and issues of war and especially peace. But over those years the subjects of the speeches, the talks, and the press conferences have become increasingly narrow, focused more and more on what the isolated world of Washington thinks is important. Gradually, you’ve heard more and more about what the government thinks or what the government should be doing and less and less about our nation’s hopes, our dreams, and our vision of the future."
382,Adjudicated,Neutral,"No man can fully grasp how far and how fast we have come, but condense, if you will, the 50,000 years of man's recorded history in a time span of but a half-century. Stated in these terms, we know very little about the first 40 years, except at the end of them advanced man had learned to use the skins of animals to cover them. Then about 10 years ago, under this standard, man emerged from his caves to construct other kinds of shelter. Only 5 years ago man learned to write and use a cart with wheels. Christianity began less than 2 years ago. The printing press came this year, and then less than 2 months ago, during this whole 50-year span of human history, the steam engine provided a new source of power."
383,Adjudicated,Neutral,"To guarantee in advance that the President's plea for national unity would be challenged, one network [A.B.C.] trotted out Averell Harriman for the occasion. Throughout the President's address, he waited in the wings. When the President concluded, Mr. Harriman recited perfectly. He attacked the Thieu Government as unrepresentative. He criticized the President's speech for various deficiencies. He twice issued a call to the Senate Foreign Relations Committee to debate Vietnam once again. He stated his belief that the Vietcong or North Vietnamese did not really want a military takeover of South Vietnam. And he told a little anecdote about a ""very, very responsible"" fellow he had met in the North Vietnamese delegation."
