ID,Adjudication,Classification,Text
206,Adjudicated,Optimistic,"So now is the time for our country to come together, to have faith in our democracy, to believe that at its core our elected officials who share the same values that have governed this country since its birth. Because now is the time that we must challenge ourselves to do better, to resolve our differences, to realize that in this country we are at our best when our leaders lead with compassion, commitment and courage. We know that doing what is right, doing what is just, is never a partisan issue."
207,Adjudicated,Pessimistic,"Let me say, too, that I have been heartened by the conduct of this convention. You have argued and disagreed, because as Democrats you care and you care deeply. But you have disagreed and argued without calling each other ""liars"" and ""thieves,"" without despoiling our best traditions -- you have not spoiled our best traditions in any naked struggles for power. And you have written a platform that neither equivocates, contradicts, nor evades. You have restated our Party's record, its principles and its purposes, in language that none can mistake, and with a firm confidence in justice, freedom, and peace on earth that will raise the hearts and the hopes of mankind for that distant day when no -- no one rattles a saber and no one drags a chain."
208,Adjudicated,Optimistic,"So, let's stand up for our children, our children's children and for this great democracy that our ancestors work to build and let's vote and let's organize to get others to vote with us. You can help make this happen by texting “vote” to 303-30. We know how important it is that we elect real leaders like Joe Biden and Kamala Harris. People of honor and integrity who hold justice close to their hearts and believe that the lives of my four black children matter. In the words of womanist poet, Audre Lorde, “Your silence will not protect you.” Congressman Lewis would not be silenced and neither can we. We cannot wait for some other time, some other place, some other heroes. We must be the heroes of our generation because we too are America. Our votes can be our voice."
209,Adjudicated,Optimistic,"We could not forget them. Even if they were not our own, we could not forget them. For all time, they are what we can only aspire to be: giving, unselfish, the epitome of human love-to lay down one's life so that others might live. We think on their lives. We think on their final moments. In our mind's eye, we see young Americans in a European forest or on an Asian island or at sea or in aerial combat. And as life expired, we know that those who could had last thoughts of us and of their love for us. As they thought of us then, so, too, we think of them now, with love, with devotion, and with faith: the certainty that what they died for was worthy of their sacrifice-faith, too, in God and in the Nation that has pledged itself to His work and to the dream of human freedom, and a nation, too, that today and always pledges itself to their eternal memory."
210,Adjudicated,Neutral,"We're also gathered here for a special event—the national funeral for an unknown soldier who will today join the heroes of three other wars. When he spoke at a ceremony at Gettysburg in 1863, President Lincoln reminded us that through their deeds, the dead had spoken more eloquently for themselves than any of the living ever could, and that we living could only honor them by rededicating ourselves to the cause for which they so willingly gave a last full measure of devotion."
211,Adjudicated,Pessimistic,"So I want to talk to you about this America, that's a good hearted America but has a government that works great for giant drug companies, just not for people trying to get a prescription filled. Works great for investors in private prisons and private detention centers just not for people whose lives are torn apart by those institutions. Works great for giant oil companies that want to drill everywhere but just not for the rest of us who see climate change bearing down upon us. Now when you see a government that works great for the rich, works great for those with money works great for those with, connections and isn't working for much of anyone else that is corruption pure and simple and we need to call it out for what it is. So here's the deal, I have the biggest anti-corruption plan since Watergate here's the bad news: we need the biggest anti-corruption plan since Watergate."
212,Adjudicated,Optimistic,"This legislation will lead to healthier lives, more liberty to pursue, hopes and dreams and happiness for the American people. This is an American proposal that honors the traditions of our country. We would not be here tonight for sure without the extraordinary leadership and vision of President Barack Obama. We thank him for his unwavering commitment to healthcare for all Americans. And this began over a year ago under his leadership in the American Recovery and Reinvestment Act where we had very significant investments in science, technology, and innovation for health reform -- healthcare reform."
213,Adjudicated,Optimistic,"The bill I’m about to sign into law -- Senate Bill 1070 -- represents another tool for our State to use as we work to solve a crisis that we did not create and the federal government has refused to fix: the crisis caused by illegal immigration and Arizona’s porous border. This bill, the Support [Our] Law Enforcement and Safe Neighborhoods Act, strengthens the laws of our State. It protects all of us, every Arizona citizen and everyone here in our State lawfully. And, it does so while ensuring that the constitutional rights of all in Arizona remain solid, stable, and steadfast."
214,Adjudicated,Pessimistic,"For more than 60 years, Marines have gone forth from Camp Lejeune to fight our country's battles. Now America has entered a fierce struggle to protect the world from a grave danger and to bring freedom to an oppressed people. As the forces of our coalition advance, we learn more about the atrocities of the Iraqi regime and the deep fear that Saddam Hussein has instilled in the Iraqi people. Yet, no scheme of this enemy, no crime of a dying regime will divert us from our mission. We will not stop until Iraq is free. When freedom needs defending, America turns to our military. And as they do their job, our men and women in uniform count on their families -- like you all here today. This is a time of hardship for many military families. Some of you have been separated from your loved ones for quite a while because of long deployments. All of America is grateful for your sacrifice. And Laura and I are here to thank each one of you."
215,Adjudicated,Pessimistic,"Success is somebody else’s failure. Success is the American Dream we can keep dreaming because most people in most places, including thirty million of ourselves, live wide awake in the terrible reality of poverty. No, I do not wish you success. I don’t even want to talk about it. I want to talk about failure. Because you are human beings you are going to meet failure. You are going to meet disappointment, injustice, betrayal, and irreparable loss. You will find you’re weak where you thought yourself strong. You’ll work for possessions and then find they possess you. You will find yourself -- as I know you already have -- in dark places, alone, and afraid."
216,Adjudicated,Pessimistic,"And the rest of my family—there was actually four of us, we were all first-generation college grads still paying off student loans—and I still remember being a ten-year-old having to have my dad's business agent’s name memorized because when that showed up on caller ID that meant Dad had a job. And I remember sometimes those months when that name wasn't showing up very often and what that meant for my family. So again, I mean not always easy but at the end of the day I grew up in a state and in a country where if you worked hard, you could make it. That's what we were promised. That's what we were told. And unfortunately right now, I mean gosh, that is just getting tougher and tougher for folks because of the policies being pushed right now by that Freedom Caucus member I'm running to replace—Rod Blum."
217,Adjudicated,Pessimistic,"What is unreasonable is that we have Iowans in rural Iowa driving ninety miles to go seek care. What is unreasonable is that we've got urban Iowans living right next door to the hospital and still can't get the care that they need. What is unreasonable is that we were facing a mental health crisis that was even more burdensome considering what COVID dealt to us, yet we still aren't getting the resources we need to take care of the mental health of Iowans across this state. That is what's unreasonable. It's a reasonable request, to ensure that our students in high school, middle school, and elementary get access to a quality education – that's not only going to ensure that they're good Iowans, but it's going to ensure that they're prepared for either college or a job after they graduate. That's a reasonable request folks."
218,Adjudicated,Optimistic,"I will not let that happen, I am not letting that happen, stick with me, continue to stand with the CFO legislation, and we will win for our children, who so desperately need good news. We continue to work hard on an issue which is just as important for our survival as fixing our fiscal crisis - crime. We have brought millions of additional dollars in. And because I have worked hard, I earned a seat on the Homeland Security committee, and am working to bring even more resources to the territory for law enforcement."
219,Adjudicated,Pessimistic,"Today our nation joins with you in grief. We mourn with you. We share your hope against hope that some may still survive. We thank all those who have worked so heroically to save lives and to solve this crime -- those here in Oklahoma and those who are all across this great land, and many who left their own lives to come here to work hand in hand with you. We pledge to do all we can to help you heal the injured, to rebuild this city, and to bring to justice those who did this evil. This terrible sin took the lives of our American family, innocent children in that building, only because their parents were trying to be good parents as well as good workers; citizens in the building going about their daily business; and many there who served the rest of us -- who worked to help the elderly and the disabled, who worked to support our farmers and our veterans, who worked to enforce our laws and to protect us. Let us say clearly, they served us well, and we are grateful."
220,Adjudicated,Optimistic,"Everyone has a story about Joe's caring and empathy. I remember him calling after my mother, Dorothy, died and we talked about being raised by strong women. The best testament to Joe is how he's cared for his family, and how great is it that Dr. Jill Biden plans to keep teaching as first lady? And Joe picked the right partner in Kamala; she's relentless in the pursuit of justice and equity and she's kind. When her press secretary, Tyrone Gayle, was dying of cancer, she dropped everything to be with him in his final moments. I know something about the slings and arrows she'll face and believe me this former district attorney and attorney general can handle them all. So, this is the team to pull our nation back from the brink but they can't do it without us. For four years people have told me, “I didn't realize how dangerous he was, I wish I could do it all over” or worst, “I should have voted.” Look this can't be another “woulda-coulda-shoulda” election. If you vote by mail, request your ballot now and send it back right away. If you vote in person, do it early, become a poll worker. Most of all, no matter what, vote. As Michelle Obama and Bernie Sanders warned us, if trump is re-elected things will get even worse. That's why we need unity now more than ever."
221,Adjudicated,Pessimistic,"Several weeks ago in New Orleans, I warned Colonel Qadhafi we would hold his regime accountable for any new terrorist attacks launched against American citizens. More recently I made it clear we would respond as soon as we determined conclusively who was responsible for such attacks. On April 5th in West Berlin a terrorist bomb exploded in a nightclub frequented by American servicemen. Sergeant Kenneth Ford and a young Turkish woman were killed and 230 others were wounded, among them some 50 American military personnel. This monstrous brutality is but the latest act in Colonel Qadhafi's reign of terror. The evidence is now conclusive that the terrorist bombing of La Belle discotheque was planned and executed under the direct orders of the Libyan regime. On March 25th, more than a week before the attack, orders were sent from Tripoli to the Libyan People's Bureau in East Berlin to conduct a terrorist attack against Americans to cause maximum and indiscriminate casualties. Libya's agents then planted the bomb. On April 4th the People's Bureau alerted Tripoli that the attack would be carried out the following morning. The next day they reported back to Tripoli on the great success of their mission."
222,Adjudicated,Pessimistic,"I just visited the grounds of Valley Forge. I’ve been there a number of times from the time I was a Boy Scout years ago. You know, it’s the very site that I think every American should visit because it tells the story of the pain and the suffering and the true patriotism it took to make America. Today, we gather in a new year, some 246 years later, just one day before January 6th, a day forever shared in our memory because it was on that day that we nearly lost America — lost it all.  "
223,Adjudicated,Pessimistic,"When I first addressed you from here, our national defenses were dangerously weak, we had suffered humiliation in Iran, and at home we were adrift, possibly because of a failure here in Washington to trust the courage and character of you, the people. But worst of all, we were on the brink of economic collapse from years of government overindulgence and abusive overtaxation. Thus, I had to report that we were ""in the worst economic mess since the Great Depression."" Inflation had risen to over 13 percent in 1979 and to 19 percent in March of 1980. Those back-to-back years of price explosions were the highest in more than 60 years. In the five years before I came here, taxes had actually doubled. Your cost-of-living pay raises just bumped you into higher tax brackets."
224,Adjudicated,Optimistic,"No role in history could be more difficult or more important. We stand for freedom. That is our conviction for ourselves—that is our only commitment to others. No friend, no neutral and no adversary should think otherwise. We are not against any man—or any nation—or any system—except as it is hostile to freedom. Nor am I here to present a new military doctrine, bearing any one name or aimed at any one area. I am here to promote the freedom doctrine. The great battleground for the defense and expansion of freedom today is the whole southern half of the globe—Asia, Latin America, Africa and the Middle East—the lands of the rising peoples. Their revolution is the greatest in human history. They seek an end to injustice, tyranny, and exploitation. More than an end, they seek a beginning."
225,Adjudicated,Optimistic,"When I started this campaign a year ago, I was working in a restaurant in downtown Manhattan, and it wasn't because…and we didn't launch this campaign because I thought I was special or unique or better than anyone else. We launched this campaign because in the absence of anyone giving a clear voice on the moral issues of our time, then it is up to us to voice them. We launched this campaign because no one was clearly and authentically talking about issues like the corrupting role of money in politics, about the disturbing human rights violations being committed by ICE, by the fact that we had no one was giving voice to the idea and the notion that an entire generation is graduating with crippling loads of student loan debt, a ticking time bomb for our economy."
226,Adjudicated,Optimistic,"Some celebrate Christmas as the birthday of a great and good philosopher and teacher. Others of us believe in the divinity of the child born in Bethlehem, that he was and is the promised Prince of Peace. Yes, we've questioned why he who could perform miracles chose to come among us as a helpless babe, but maybe that was his first miracle, his first great lesson that we should learn to care for one another. Tonight, in millions of American homes, the glow of the Christmas tree is a reflection of the love Jesus taught us. Like the shepherds and wise men of that first Christmas, we Americans have always tried to follow a higher light, a star, if you will. At lonely campfire vigils along the frontier, in the darkest days of the Great Depression, through war and peace, the twin beacons of faith and freedom have brightened the American sky. At times our footsteps may have faltered, but trusting in God's help, we've never lost our way."
227,Adjudicated,Pessimistic,"While the so-called religious issue is necessarily and properly the chief topic here tonight, I want to emphasize from the outset that I believe that we have far more critical issues in the 1960 campaign; the spread of Communist influence, until it now festers only 90 miles from the coast of Florida -- the humiliating treatment of our President and Vice President by those who no longer respect our power -- the hungry children I saw in West Virginia, the old people who cannot pay their doctors bills, the families forced to give up their farms -- an America with too many slums, with too few schools, and too late to the moon and outer space. These are the real issues which should decide this campaign. And they are not religious issues -- for war and hunger and ignorance and despair know no religious barrier."
228,Adjudicated,Neutral,"The other -- The other framing aspect of the conversations in Houston actually built on what I did the Friday before traveling to Houston, which was the annual U.S.-EU Energy Council. We were very pleased to have Commissioner Kadri Simson and Director General Ditte Jorgensen both at the State Department for the annual Energy Council. This year in particular was a celebration of the tremendous progress that we have made in our transatlantic energy relationship, the degree to which Europe has exceeded expectations in de-risking its exposure to Russian energy coercion -- dramatically reducing Europe’s dependence on Russian oil, gas, coal, and looking to the future, nuclear fuel -- but also the very strong alignment between U.S. and European objectives as we seek to navigate the disruption of global markets that Putin’s invasion of Ukraine and the weaponization of Russia’s energy resources has prompted."
229,Adjudicated,Optimistic,"I know that many of the people listening to the speech tonight may not have voted for me, but I want you to know I will stand up for you and I ask you to work with me to move our state forward. Here is the promise I want to make you: I WILL BE A SENATOR FOR ALL OF WISCONSIN! Now, our state has had some incredible leaders from both political parties and all across the ideological spectrum. And I have a lot of good examples to follow. One is Herb Cole. You know that when he first ran for the U.S. Senate, his slogan was NOBODY'S SENATOR BUT YOURS. But now his senate became a title, one that he has earned every day that he has served the state of Wisconsin. I am so grateful to have had his support throughout this campaign and humbled to carry his deep commitment to public service. I also want to thank Tommy Thompson for his life in public service, and before I do I want you to indulge me on an acknowledgement on a very personal level. I just got off the phone with him, he was very cordial, congratulated me and wished me and every one of us well."
230,Adjudicated,Pessimistic,"But you all know I did not run to be a first. I ran because I came to this country. I heard of its promises. And when I looked around this district to see many who have never known the bounty of the American promise, the promise of life liberty and the pursuit of happiness. This country is supposed to be the land where people have the tools necessary to lead a life that is prosperous. Yet indigenous people, promised homes, are living in tents like refugees in their own land. Millennials, promised the American Dream if they study hard, enough only to find that dream deferred by the harsh realities of our economy. Immigrants, promised the land of opportunity, are too often met with bigotry and hate."
231,Adjudicated,Optimistic,"Let both sides, for the first time, formulate serious and precise proposals for the inspection and control of arms, and bring the absolute power to destroy other nations under the absolute control of all nations. Let both sides seek to invoke the wonders of science instead of its terrors. Together let us explore the stars, conquer the deserts, eradicate disease, tap the ocean depths, and encourage the arts and commerce."
232,Adjudicated,Pessimistic,"But I have an uncomfortable feeling that this prosperity isn't something on which we can base our hopes for the future. No nation in history has ever survived a tax burden that reached a third of its national income. Today, 37 cents out of every dollar earned in this country is the tax collector's share, and yet our government continues to spend 17 million dollars a day more than the government takes in. We haven't balanced our budget 28 out of the last 34 years. We've raised our debt limit three times in the last twelve months, and now our national debt is one and a half times bigger than all the combined debts of all the nations of the world. We have 15 billion dollars in gold in our treasury; we don't own an ounce. Foreign dollar claims are 27.3 billion dollars. And we've just had announced that the dollar of 1939 will now purchase 45 cents in its total value."
233,Adjudicated,Pessimistic,"So today, we dumped another 70 million tons of global-warming pollution into the thin shell of atmosphere surrounding our planet, as if it were an open sewer. And tomorrow, we will dump a slightly larger amount, with the cumulative concentrations now trapping more and more heat from the sun. As a result, the earth has a fever. And the fever is rising. The experts have told us it is not a passing affliction that will heal by itself. We asked for a second opinion. And a third. And a fourth. And the consistent conclusion, restated with increasing distress, is that something basic is wrong."
234,Adjudicated,Pessimistic,"But one hundred years later, the Negro still is not free. One hundred years later, the life of the Negro is still sadly crippled by the manacles of segregation and the chains of discrimination. One hundred years later, the Negro lives on a lonely island of poverty in the midst of a vast ocean of material prosperity. One hundred years later, the Negro is still languished in the corners of American society and finds himself an exile in his own land. And so we've come here today to dramatize a shameful condition. In a sense we've come to our nation's capital to cash a check. When the architects of our republic wrote the magnificent words of the Constitution and the Declaration of Independence, they were signing a promissory note to which every American was to fall heir. This note was a promise that all men, yes, black men as well as white men, would be guaranteed the ""unalienable Rights"" of ""Life, Liberty and the pursuit of Happiness."" It is obvious today that America has defaulted on this promissory note, insofar as her citizens of color are concerned. Instead of honoring this sacred obligation, America has given the Negro people a bad check, a check which has come back marked ""insufficient funds."""
235,Adjudicated,Pessimistic,"At times history and fate meet at a single time in a single place to shape a turning point in man's unending search for freedom. So it was at Lexington and Concord. So it was a century ago at Appomattox. So it was last week in Selma, Alabama. There, long-suffering men and women peacefully protested the denial of their rights as Americans. Many were brutally assaulted. One good man, a man of God, was killed. There is no cause for pride in what has happened in Selma. There is no cause for self-satisfaction in the long denial of equal rights of millions of Americans. But there is cause for hope and for faith in our democracy in what is happening here tonight. For the cries of pain and the hymns and protests of oppressed people have summoned into convocation all the majesty of this great government -- the government of the greatest nation on earth. "
236,Adjudicated,Pessimistic,"Baghdadi and the losers who worked with him – in some cases people who had no idea what they were getting into and how dangerous and unglamorous it was – killed many people.  Their murder of innocent Americans Jim Foley, Steven Sotloff, Peter Kassig, and Kayla Mueller were especially heinous.  The shocking publicized murder of a Jordanian pilot who was burned alive in a cage for all to see, and the execution of Christians in Libya and Egypt, as well as the genocidal mass murder of Yazidis, rank ISIS among the most depraved organizations in history. The forced religious conversions, the orange suits prior to many beheadings, all of which were openly displayed for the world – this was all Abu Bakr al-Baghdadi’s work.  He was vicious and violent, and he died in a vicious and violent way, as a coward, running and crying.  This raid was impeccable, and could only have taken place with the acknowledgement and help of certain other nations and people."
