ID,Adjudication,Classification,Text
0,Adjudicated,Pessimistic,"But the hard truth is that not everyone is sharing in this city's splendor and glory. A shining city is perhaps all the President sees from the portico of the White House and the veranda of his ranch, where everyone seems to be doing well. But there's another city; there's another part to the shining the city; the part where some people can't pay their mortgages, and most young people can't afford one; where students can't afford the education they need, and middle-class parents watch the dreams they hold for their children evaporate. In this part of the city there are more poor than ever, more families in trouble, more and more people who need help but can't find it. Even worse: There are elderly people who tremble in the basements of the houses there. And there are people who sleep in the city streets, in the gutter, where the glitter doesn't show. There are ghettos where thousands of young people, without a job or an education, give their lives away to drug dealers every day. There is despair, Mr. President, in the faces that you don't see, in the places that you don't visit in your shining city."
1,Adjudicated,Pessimistic,"I understand -- I understand the sense of frustration and despair in our country, because I know firsthand about shouting for help and getting no answer. I went to Washington to tell Presidents Reagan and Bush that much, much more had to be done for AIDS research and care, and that children couldn't be forgotten. The first time, when nothing happened, I thought, ""They just didn't hear me."" The second time, when nothing happened, I thought, ""Maybe I didn't shout loud enough."" But now I realize they don't hear because they don't want to listen. When you cry for help and no one listens, you start to lose your hope. I began to lose faith in America. I felt my country was letting me down -- and it was. This is not the America I was raised to be proud of. I was raised to believe that other's problems were my problems as well. But when I tell most people about HIV, in hopes that they will help and care, I see the look in their eyes: ""It's not my problem,"" they're thinking. Well, it's everyone's problem and we need a leader who will tell us that. We need a visionary to guide us -- to say it wasn't all right for Ryan White to be banned from school because he had AIDS, to say it wasn't alright for a man or a woman to be denied a job because they're infected with this virus. We need a leader who is truly committed to educating us."
2,Adjudicated,Optimistic,"Now, what should happen when you make a mistake is this: You take your knocks, you learn your lessons, and then you move on. That's the healthiest way to deal with a problem. This in no way diminishes the importance of the other continuing investigations, but the business of our country and our people must proceed. I've gotten this message from Republicans and Democrats in Congress, from allies around the world, and—if we're reading the signals right—even from the Soviets. And of course, I've heard the message from you, the American people. You know, by the time you reach my age, you've made plenty of mistakes. And if you've lived your life properly—so, you learn. You put things in perspective. You pull your energies together. You change. You go forward. My fellow Americans, I have a great deal that I want to accomplish with you and for you over the next two years. And the Lord willing, that's exactly what I intend to do. Good night, and God bless you."
3,Adjudicated,Pessimistic,"Mr. Speaker, Members, I rise today really with a very heavy heart, one that is filled with sorrow for the families and the loved ones who were killed and injured this week. Only the most foolish and the most callous would not understand the grief that has really gripped our people and millions across the world. This unspeakable act on the United States has really -- really forced me, however, to rely on my moral compass, my conscience, and my God for direction. September 11th changed the world. Our deepest fears now haunt us. Yet, I am convinced that military action will not prevent further acts of international terrorism against the United States. This is a very complex and complicated matter."
4,Adjudicated,Neutral,"You know, we heard the horror stories about the lines in England and Canada and even in New Zealand. It doesn't have to be that way. With a market as large as ours, with the capacity as deep as ours, I have every confidence that the American people are innovative and creative enough to come up with reform of the payment system for health care in ways that will preserve our values around what health care should do. And those values include providing the best quality care to everyone without regard to means, and making certain that physicians and providers are in a position to make decisions that they are best able and capable to make, and that we eliminate the human suffering and the insecurity and the job block and all the horrors you've heard about by finally settling on the notion that rationality in the way that we pay for something that is as personal as health care ought to be our first priority."
5,Adjudicated,Optimistic,"We have made considerable progress in battling COVID-19. When I became President, about 2 million Americans were fully vaccinated. Today, over 175 million Americans have that protection. We’re in a tough stretch, and it could last for a while... The vaccines provide very strong protection from severe illness from COVID-19. I know there’s a lot of confusion and misinformation. But the world’s leading scientists confirm that if you are fully vaccinated, your risk of severe illness from COVID-19 is very low."
6,Adjudicated,Optimistic,"Good evening, I'm Kellyanne Conway. 100 years ago, courageous warriors helped women secure the right to vote. This has been a century worth celebrating but also a reminder that our democracy is young and fragile. For many of us women's empowerment is not a slogan. It comes not from strangers on social media or sanitized language in a corporate handbook; it comes from the everyday heroes who nurture us, who shape us and who believe in us. The promise of America belongs to us all. This is a land of inventors and innovators, of entrepreneurs and educators, of pioneers and parents, each contributing to the success and the future of a great nation and her people."
7,Adjudicated,Neutral,"Good morning. The global devastation of HIV/AIDS staggers the imagination and shocks the conscience. The disease has already killed over 20 million people and it's poised to kill at least 40 million more. In Africa, the disease clouds the future of entire nations and threatens to hold back the hopes of an entire continent. In the hardest-hit countries of sub-Sahara Africa as much as one-third of the adult population is infected with HIV, and 10 percent or more of the school teachers will die of AIDS within five years. Today I announce that my administration plans to make $500 million available to prevent mother-to-child transmission of HIV. This new effort, which will be funded during the next 16 months, will allow us to treat one million women annually, and reduce mother-to-child transmission by 40 percent within five years or less in target countries."
8,Adjudicated,Optimistic,"Nancy and I are most grateful to be with you here today, and I'll take a chance and say, muintir na hEireann [people of Ireland]. Did I get it right? [Applause] All right. Well, it's difficult to express my appreciation to all of you. I feel like I'm about to drown everyone in a bath of nostalgia. Of all the honors and gifts that have been afforded me as President, this visit is the one that I will cherish dearly. You see, I didn't know much about my family background-not because of a lack of interest, but because my father was orphaned before he was 6 years old. And now thanks to you and the efforts of good people who have dug into the history of a poor immigrant family, I know at last whence I came. And this has given my soul a new contentment. And it is a joyous feeling. It is like coming home after a long journey. What unites us is our shared heritage and the common values of our two peoples. So many Irish men and women from every walk of life played a role in creating the dream of America. One was Charles Thompson, Secretary of the Continental Congress, and who designed the first Great Seal of the United States. I'm certainly proud to be part of that great Irish American tradition. From the time of our revolution when Irishmen filled the ranks of the Continental Army, to the building of the railroads, to the cultural contributions of individuals like the magnificent tenor John McCormack and the athletic achievements of the great heavyweight boxing champion John L. Sullivan—all of them are part of a great legacy."
9,Adjudicated,Neutral,"Now, this doesn’t mean we can afford to stand still.  The nature of our leadership will need to change with the times.  As I said the first time I came to London as President, for the G20 summit, the days are gone when Roosevelt and Churchill could sit in a room and solve the world’s problems over a glass of brandy  -– although I’m sure that Prime Minister Cameron would agree that some days we could both use a stiff drink.  (Laughter.)  In this century, our joint leadership will require building new partnerships, adapting to new circumstances, and remaking ourselves to meet the demands of a new era. Today, we confront a different enemy.  Terrorists have taken the lives of our citizens in New York and in London.  And while al Qaeda seeks a religious war with the West, we must remember that they have killed thousands of Muslims -– men, women and children -– around the globe. Our nations are not and will never be at war with Islam. Our fight is focused on defeating al Qaeda and its extremist allies.  In that effort, we will not relent, as Osama bin Laden and his followers have learned.  And as we fight an enemy that respects no law of war, we will continue to hold ourselves to a higher standard -– by living up to the values, the rule of law and due process that we so ardently defend."
10,Adjudicated,Optimistic,"We must act today in order to preserve tomorrow. And let there be no misunderstanding -- we’re going to begin to act beginning today. The economic ills we suffer have come upon us over several decades. They will not go away in days, weeks, or months, but they will go away. They will go away because we as Americans have the capacity now, as we have had in the past, to do whatever needs to be done to preserve this last and greatest bastion of freedom. So with all the creative energy at our command, let us begin an era of national renewal. Let us renew our determination, our courage, and our strength. And let us renew our faith and our hope. We have every right to dream heroic dreams."
11,Adjudicated,Pessimistic,"But we still have this guy in the White House. And every single morning he wakes up, and he tries to divide us. He sends out tweets going after immigrants, he goes after people of color, he belittles people that don’t agree with him and he allows a foreign country to make mincemeat of our democracy. We have a president that can't keep his decisions seven minutes from now."
12,Adjudicated,Pessimistic,"It's not enough for us to view this as some remote event in which we, ourselves, are not involved. For our friends in Lebanon and Israel, for our friends in Europe and elsewhere in the Middle East, and for us as Americans, this tragedy, horrible as it is, reminds us of the absolute imperative of bringing peace to that troubled country and region. The people of Lebanon must have learned that the cycle of massacre upon massacre must end. Children are not avenged by the murder of other children. Israel must have learned that there is no way it can impose its own solutions on hatreds as deep and bitter as those that produced this tragedy. The participation of American forces in Beirut will again be for a limited period. But I've concluded there is no alternative to their returning to Lebanon if that country is to have a chance to stand on its own feet."
13,Adjudicated,Pessimistic,"Events in Iraq have now reached the final days of decision... Since then, the world has engaged in 12 years of diplomacy. We have passed more than a dozen resolutions in the United Nations Security Council. We have sent hundreds of weapons inspectors to oversee the disarmament of Iraq. Our good faith has not been returned. The danger is clear: using chemical, biological or, one day, nuclear weapons, obtained with the help of Iraq, the terrorists could fulfill their stated ambitions and kill thousands or hundreds of thousands of innocent people in our country, or any other."
14,Adjudicated,Optimistic,"I hope that every American, regardless of where he lives, will stop and examine his conscience about this and other related incidents. This Nation was founded by men of many nations and backgrounds. It was founded on the principle that all men are created equal, and that the rights of every man are diminished when the rights of one man are threatened. Today, we are committed to a worldwide struggle to promote and protect the rights of all who wish to be free. But legislation, I repeat, cannot solve this problem alone. It must be solved in the homes of every American in every community across our country. Therefore, I'm asking for your help in making it easier for us to move ahead and to provide the kind of equality of treatment which we would want ourselves; to give a chance for every child to be educated to the limit of his talents."
15,Adjudicated,Optimistic,"Most women will agree that August 23, the day when the Tennessee legislature finally enacted the Federal suffrage amendment, is a day to begin with, not a day to end with. Men are saying perhaps 'Thank God, this everlasting woman’s fight is over!' But women, if I know them, are saying, 'Now at last we can begin.' Woman’s freedom, in the feminist sense, can be fought for and conceivably won before the gates open into industrial democracy. The immediate feminist program must include voluntary motherhood. Freedom of any kind for women is hardly worth considering unless it is assumed that they will know how to control the size of their families."
16,Adjudicated,Neutral,"By gathering in Beijing, we are focusing world attention on issues that matter most in our lives -- the lives of women and their families: access to education, health care, jobs and credit, the chance to enjoy basic legal and human rights and to participate fully in the political life of our countries. Our goals for this conference, to strengthen families and societies by empowering women to take greater control over their own destinies, cannot be fully achieved unless all governments -- here and around the world -- accept their responsibility to protect and promote internationally recognized human rights."
17,Adjudicated,Optimistic,"Thank you for organizing your communities and shattering records – more than 1.9 million voters who stood up for protecting our public schools, continued criminal justice reform, Medicaid expansion and real economic mobility for all of our counties. We won state House races and Senate races, a new seat in Congress and put America on notice that change is not coming – it has arrived. And you made it so. But those who fear change pushed back, and so we waited for the whole truth of this election – good and evil – to come forth. So thank you sharing your stories, for the tens of thousands of calls into our voter protection line. Thank you for volunteering your hours after the polls closed and for the past ten days. For driving to all 159 counties and for hearing the concerns of Georgia citizens, through tears and frustration and disappointment Because Georgia still has a decision to make about who will we be in the next election. And the one after that. And the one after that. So we have used this election and its aftermath to diagnose what has been broken in our process."
18,Adjudicated,Neutral,"With such a history behind it, how can our nation escape the logic it has never failed to follow, when its last un-enfranchised class calls for the vote? Behold our Uncle Sam floating the banner with one hand, ""Taxation without representation is tyranny,"" and with the other seizing the billions of dollars paid in taxes by women to whom he refuses ""representation."" Behold him again, welcoming the boys of twenty-one and the newly made immigrant citizen to ""a voice in their own government"" while he denies that fundamental right of democracy to thousands of women public school teachers from whom many of these men learn all they know of citizenship and patriotism, to women college presidents, to women who preach in our pulpits, interpret law in our courts, preside over our hospitals, write books and magazines, and serve in every uplifting moral and social enterprise. Is there a single man who can justify such inequality of treatment, such outrageous discrimination? Not one... Second, the suffrage for women already established in the United States makes women suffrage for the nation inevitable. When Elihu Root, as president of the American Society of International Law, at the eleventh annual meeting in Washington, April 26, 1917, said, ""The world cannot be half democratic and half autocratic. It must be all democratic or all Prussian. There can be no compromise,"" he voiced a general truth. Precisely the same intuition has already taught the blindest and most hostile foe of woman suffrage that our nation cannot long continue a condition under which government in half its territory rests upon the consent of half of the people and in the other half upon the consent of all the people; a condition which grants representation to the taxed in half of its territory and denies it in the other half a condition which permits women in some states to share in the election of the president, senators, and representatives and denies them that privilege in others. It is too obvious to require demonstration that woman suffrage, now covering half our territory, will eventually be ordained in all the nation. No one will deny it. The only question left is when and how will it be completely established."
19,Adjudicated,Neutral,"Secretary Gates, the Defense Gates recently described Afghanistan to the U.S. Congress as posing 'our greatest military challenge right now.' As he noted, our fundamental objective in Afghanistan is to ensure that transnational terrorists are not able to reestablish the sanctuaries they enjoyed prior to 9/11. In fact, there has been nothing easy about Afghanistan. And as Senator Lieberman observed recently in a speech to the Brookings institution, 'Reversing Afghanistan’s slide into insecurity will not come quickly, easily, or cheaply.' Similarly, Secretary Gates told Congress, 'this will undoubtedly be a long and difficult fight.' On a related note, given the importance of Afghan solutions and governance being viewed as legitimate by the people and in view of allegations of corruption, such efforts likely should feature support for what might be called an 'Afghan accountability offensive' as well. That will be an important effort."
20,Adjudicated,Pessimistic,"But today, I weep for my country. I have watched the events of recent months with a heavy, heavy heart. No more is the image of America one of strong, yet benevolent peacekeeper. The image of America, Madam President, has changed. Around the globe, our friends mistrust us; our word is disputed; our intentions are questioned. Instead of reasoning with those with whom we disagree, we demand obedience, or threaten recrimination. Instead of isolating Saddam Hussein, we seem to have succeeded in isolating ourselves. We proclaim a new doctrine of preemption which is understood by few and feared by many. We say that the United States has the right to turn its firepower on any corner of the globe which might be suspect in the war on terrorism. We assert that right without the sanction of any international body. As a result, the world has become a much more dangerous place. We flaunt our superpower status with arrogance. We treat UN Security Council members like ingrates who offend our princely dignity by lifting their heads from the carpet. Valuable alliances are split. After the war has ended, the United States will have to rebuild much more than the country of Iraq. We will have to rebuild America's image around the globe."
21,Adjudicated,Optimistic,"My name is Val Demings and I'm running for Congress in the great state of Florida. I spent 27 years on the Orlando Police Force and had the honor of serving as Orlando's first woman chief of police. I know firsthand the tragedy that gun violence inflicts on families in America, and after 49 people were murdered in a nightclub in Orlando last month, let me tell you, our city takes it personally that Congress refuses to disarm hate. You don't need to be a police chief to know that our communities are less safe when criminals and suspected terrorists can walk into a gun shop or gun show and leave with a weapon. On issue after issue it's the leadership of women that makes a stronger America. With Hillary Clinton in the White House and these strong house Democratic women, together with women and families all across our nation, we will show the world what this statement really means. When women succeed, America succeeds. Thank you."
22,Adjudicated,Neutral,"The truth of these words is beyond doubt, but the mission to which they call us is a most difficult one. Even when pressed by the demands of inner truth, men do not easily assume the task of opposing their government's policy, especially in time of war. Nor does the human spirit move without great difficulty against all the apathy of conformist thought within one's own bosom and in the surrounding world. Moreover, when the issues at hand seem as perplexing as they often do in the case of this dreadful conflict, we are always on the verge of being mesmerized by uncertainty; but we must move on. And some of us who have already begun to break the silence of the night have found that the calling to speak is often a vocation of agony, but we must speak. We must speak with all the humility that is appropriate to our limited vision, but we must speak. And we must rejoice as well, for surely this is the first time in our nation's history that a significant number of its religious leaders have chosen to move beyond the prophesying of smooth patriotism to the high grounds of a firm dissent based upon the mandates of conscience and the reading of history. Perhaps a new spirit is rising among us. If it is, let us trace its movements and pray that our own inner being may be sensitive to its guidance, for we are deeply in need of a new way beyond the darkness that seems so close around us. Over the past two years, as I have moved to break the betrayal of my own silences and to speak from the burnings of my own heart, as I have called for radical departures from the destruction of Vietnam, many persons have questioned me about the wisdom of my path. At the heart of their concerns this query has often loomed large and loud: ""Why are you speaking about the war, Dr. King?"" ""Why are you joining the voices of dissent?"" ""Peace and civil rights don't mix,"" they say. ""Aren't you hurting the cause of your people,"" they ask? And when I hear them, though I often understand the source of their concern, I am nevertheless greatly saddened, for such questions mean that the inquirers have not really known me, my commitment or my calling. Indeed, their questions suggest that they do not know the world in which they live."
23,Adjudicated,Optimistic,"Joe knows the fear military families live because he's felt that dread of never knowing if your deployed loved one is safe. He understands their bravery because he has had to muster that same strength every hour of every day Beau was overseas. That's the kind of leader our service members deserve. One who understands the risks they face and who would actually protect them by doing his job as commander-in-chief. Instead, they have a coward-in-chief who won't stand up to Vladimir Putin, read his daily intelligence briefings or even publicly admonish adversaries for reportedly putting bounties on our troops’ heads. As president, Joe Biden would never let tyrants manipulate him like a puppet, he would never pervert our military to stroke his own ego, he would never turn his back on our troops or threaten them against Americans peacefully exercising their constitutional rights. Joe Biden would stand up for what’s right, stand tall for our troops and stand strong against our enemies because unlike Trump, Joe Biden has common decency, he has common sense, he can command both from experience and from strength. Donald Trump doesn't deserve to call himself commander-in-chief for another four minutes, let alone another four years. Our troops deserve better, our country deserves better."
